{
  "schema_version": 1,
  "pin_id": "metis-brain-toolchain/2026-09-04-v2",
  "repository": "ares-matioska/metis",
  "revision": "3fde0820c04244b011a2f7a9604c425891424b34",
  "tree": "432bd3babd9f4c2dfe6349288b12eba917d4fe73",
  "remote_url": "git@github.com:ttessarolo/metis.git",
  "remote_ref": "refs/remotes/origin/main",
  "language_version": "0.43",
  "tooling_version": "0.24.1",
  "runtime": {
    "node_version": "v22.22.3",
    "node_sha256": "sha256:5d9d3872911e2340a43b707962e68143de8a4e8d54628845c0c4f2de1fb7cd5c",
    "node_bytes": 112915776,
    "node_modules_sha256": "sha256:5ba3b1ef8e399260fa40c840fdeffd255931b37c01d284b4d445c0311533e7e5",
    "langium_version": "4.3.0",
    "metis_language_version": "0.43",
    "grammar_sha256": "sha256:dbbb2cf98f870d854af9082cb8ee33595054e993d7831d662170aeea0db8db01",
    "package_sha256": "sha256:2f8f19f2f1243a9ae935ff0dd0198cbd922899ea3cb4d9b46dc0884addcd38cd",
    "lock_sha256": "sha256:f4cdd6f88854ad0ce9df9bfb9edb8174a584dfa7e6beb17099dd6b500a5d3b89"
  },
  "evidence": [
    {"id": "grammar", "path": "tooling/src/language/metis.langium", "blob_oid": "7812a896fbf5c7b97683c6a487ed390687bff3d1", "sha256": "sha256:dbbb2cf98f870d854af9082cb8ee33595054e993d7831d662170aeea0db8db01"},
    {"id": "generated_ast", "path": "tooling/src/language/generated/ast.ts", "blob_oid": "d3cfddc50a860a81be24c96851fe023913493a3a", "sha256": "sha256:1debeb436e056cd44992d20cb2dcbc62c7d10c01d09536d5250e0f80c19747f4"},
    {"id": "generated_grammar", "path": "tooling/src/language/generated/grammar.ts", "blob_oid": "53dd0b033a6d21abd19261f008a4182119da4b14", "sha256": "sha256:1133e3d7ab27c774cdf625166227394b42a2a6ff1c4b649bf73b1d8b9ead1175"},
    {"id": "domain_resolver", "path": "tooling/src/language/field-values.ts", "blob_oid": "f2c1e363111e8fedf8ae2535dc0f7bcf555d397d", "sha256": "sha256:34d41e628f7ddf3aa1c92d0407dfecc5cac574e45c5fe77e4b7c30785c742899"},
    {"id": "semantic_authority", "path": "tooling/src/language/catalog-semantics.ts", "blob_oid": "6200b609a5409635f940bb4f9cb6d8ca7916cde1", "sha256": "sha256:7b822a9a506e985465af770e8207b3992d584c8d739bc2f44fbeb425761ab2f1"},
    {"id": "validator", "path": "tooling/src/language/metis-validator.ts", "blob_oid": "001e97b5041df82d3cc22a74fbaddf07ade46cfd", "sha256": "sha256:7ce438164272d009759de01a507e8a1b032c428881a4328262b5ecf5cae179fd"},
    {"id": "formatter", "path": "tooling/src/language/metis-formatter.ts", "blob_oid": "112e3da66eef6cb2a914fd326a86dfd2fd5eba38", "sha256": "sha256:77bdd32cb53a6b729363a61658999e0ad55003cec5ff335cd38844f86b4f527c"},
    {"id": "language_compiler_bridge", "path": "tooling/src/language/metis-compile.ts", "blob_oid": "abd5df1f76b887aabe31aafd5f2c622107a36e8b", "sha256": "sha256:5680c22985e9dc39388888bd9d08ec791a15bc1d4b8169dd31a8a7cd1d2f2270"},
    {"id": "compiler", "path": "tooling/src/compiler/compile.ts", "blob_oid": "3682b1f093bbab9f03701141101b2bc9372a3665", "sha256": "sha256:b9799ae73a5a79aba09ded0dd228e24fe23ec1a314376628a8a784aa0f3d7bf4"},
    {"id": "ir_contract", "path": "tooling/src/compiler/ir.ts", "blob_oid": "64f3735aa6cc677c57dc7f496a6ac44eebba03e0", "sha256": "sha256:88059ec5ee41810a5da02a8192dbd3ffe1b05b69cacc555466cc51bd2f2ca797"},
    {"id": "retrieval_cli", "path": "tooling/src/cli/catalog-domain.ts", "blob_oid": "028233f24af3989328df676f01f22197b5d5ee89", "sha256": "sha256:3750094c836cc50e5df7e469f9a05fbfef27c69f2b4e1787e37a8a90ceaeda58"},
    {"id": "semantic_retrieval_oracle", "path": "tooling/test/catalog-semantic.ts", "blob_oid": "c63dfaa43929b23395add6bec84eebd0148ab78c", "sha256": "sha256:e9e02bed80c74533115a9b275e5dddb5351d86fdb69aa61e88d2e04c02e1d52e"},
    {"id": "r8_description", "path": "tooling/test/r8-description-invariant.ts", "blob_oid": "0350c44490ebb20538211f3c8500d25d65da83b0", "sha256": "sha256:651f52b8ed82f584cad8209a136a90022c4019ab4a64a13b8416c4e73a2cf70d"},
    {"id": "r8_surface", "path": "tooling/test/r8-semantic-surface.ts", "blob_oid": "6bb94d02c32cf0f80a645f607bc55992b7d31718", "sha256": "sha256:0a21cab1a52ed4a8d67374cbddae81e55eac415f7da6e5e048586dfd055659b5"},
    {"id": "tooling_package", "path": "tooling/package.json", "blob_oid": "dccb20908beb8415c679be7f70ee8b00ef4a3a60", "sha256": "sha256:2f8f19f2f1243a9ae935ff0dd0198cbd922899ea3cb4d9b46dc0884addcd38cd"},
    {"id": "tooling_lock", "path": "tooling/package-lock.json", "blob_oid": "af78391365ff2784a081df9b957eb8c1acbccb28", "sha256": "sha256:f4cdd6f88854ad0ce9df9bfb9edb8174a584dfa7e6beb17099dd6b500a5d3b89"}
    ,{"id": "lossless_types", "path": "tooling/src/lossless/types.ts", "blob_oid": "c9bd23a5d72cccaf7e4e51b6bcac2656b26a30eb", "sha256": "sha256:b0eb1de471f7b92719fdb70b084b21d00f1be0a6127bb6b316e1599bc7db4b8d"}
    ,{"id": "lossless_inventory", "path": "tooling/src/lossless/inventory.ts", "blob_oid": "cbdf627c36b281fe25c9ead48a391e0dadf2f5da", "sha256": "sha256:18d294c19c42a23db96e7e73f7fe1585c1106148022091e4d484c39af8de0937"}
    ,{"id": "lossless_plan", "path": "tooling/src/lossless/plan.ts", "blob_oid": "78351e5927aa71d27648710f759a398f1d1b0e20", "sha256": "sha256:1d982994f0c27577553d9d9c63d069409e5b84bb2abe74f12376275884ab5f6e"}
    ,{"id": "lossless_apply", "path": "tooling/src/lossless/apply.ts", "blob_oid": "1d25e9faf7d2ebf1e413ac3fde27673b544d5717", "sha256": "sha256:88a7155c5ad342295f03ca563a3e9ae6ccb49dd8498ba0359a254ed9d2c825c5"}
    ,{"id": "lossless_toolchain", "path": "tooling/src/lossless/toolchain.ts", "blob_oid": "45ebb166e2b82cfa82bd221e1f7bbc878e1807cc", "sha256": "sha256:f8b1aa6bafd21cd42c9a4a3580f99a13124cfb256a9d88ac4dece2186a8c6127"}
    ,{"id": "lossless_cli", "path": "tooling/src/cli/lossless.ts", "blob_oid": "4662c09509faf6c8ae7152ddc3bfb14e458b9576", "sha256": "sha256:8965bcfb5634074e8df6c9b54c303078b8840ee0556d79d6dab9830931accf77"}
    ,{"id": "lossless_spec", "path": "docs/design/lossless-renderer/spec.md", "blob_oid": "f2a7139ea61ba6b48bad255f173495a1c2beefe2", "sha256": "sha256:6091ba319005fc26ef4d3276be486efbbe236db2e24ab2fc7434525a116bb717"}
    ,{"id": "lossless_api", "path": "docs/design/lossless-renderer/api.md", "blob_oid": "98e871ef50c61329e6a1a7fd9a20fea93b243778", "sha256": "sha256:fcf9812049b4f843c26e21f85370c9827ace650a14b273795c0b1c1c05a473eb"}
    ,{"id": "lossless_gate_roundtrip", "path": "tooling/test/lossless-roundtrip-corpus.ts", "blob_oid": "33cd3bfa24f4007e1f8c122115cc174888680213", "sha256": "sha256:f080e50cb10432809b3fcfce70fd1eac95854d9ca6b6281f371b6bfad865297f"}
    ,{"id": "lossless_gate_adversarial", "path": "tooling/test/lossless-adversarial.ts", "blob_oid": "435dcb2645162cb7464c61b105fef5872f8e3c26", "sha256": "sha256:c41c98064a41c39e133d24370c4050b60380a7024ed034f39d3a4d95e26a83ec"}
    ,{"id": "lossless_gate_editplan", "path": "tooling/test/lossless-editplan.ts", "blob_oid": "2536764739450296f80625a6ad0982bbd0a087da", "sha256": "sha256:d26ac69424361dced94de86c5978b531e2b96f8ba206f6fc6e4516f819c70d85"}
    ,{"id": "lossless_gate_minimal", "path": "tooling/test/lossless-edit-minimal.ts", "blob_oid": "062c976ee2b9e676f326749e880526ee6f9069ea", "sha256": "sha256:058537bcb9f6fb7c9de4671c50fa6b469c50598b1c80fdf4b162a3746d963f64"}
    ,{"id": "lossless_gate_compile", "path": "tooling/test/lossless-compile-proof.ts", "blob_oid": "2cbb069e325687abf05a93d3f0b10073f57ae2f0", "sha256": "sha256:2f84501b5cb18ffc74fdb5a8ef91f415a7d071cc050c1fb83a4d164174b06a89"}
  ],
  "probes": [
    {"id": "typecheck", "cwd": "tooling", "argv": ["node", "node_modules/typescript/bin/tsc", "--noEmit", "-p", "tsconfig.probes.json"], "success_marker": null},
    {"id": "semantic_retrieval", "cwd": "tooling", "argv": ["node", "--import", "tsx", "test/catalog-semantic.ts"], "success_marker": "catalog semantic retrieval (schema 2): VERDE ✓"},
    {"id": "r8_description", "cwd": "tooling", "argv": ["node", "--import", "tsx", "test/r8-description-invariant.ts"], "success_marker": "R8 invariante (esteso a Catalog/Field/ValueItem/ListEntry): OK"},
    {"id": "r8_surface", "cwd": "tooling", "argv": ["node", "--import", "tsx", "test/r8-semantic-surface.ts"], "success_marker": "superficie semantica: OK"},
    {"id": "lossless_roundtrip", "cwd": "tooling", "argv": ["node", "--import", "tsx", "test/lossless-roundtrip-corpus.ts"], "success_marker": "LOSSLESS_ROUNDTRIP_CORPUS: VERDE ✓"},
    {"id": "lossless_adversarial", "cwd": "tooling", "argv": ["node", "--import", "tsx", "test/lossless-adversarial.ts"], "success_marker": "LOSSLESS_ADVERSARIAL: VERDE ✓"},
    {"id": "lossless_editplan", "cwd": "tooling", "argv": ["node", "--import", "tsx", "test/lossless-editplan.ts"], "success_marker": "LOSSLESS_EDITPLAN: VERDE ✓"},
    {"id": "lossless_minimal", "cwd": "tooling", "argv": ["node", "--import", "tsx", "test/lossless-edit-minimal.ts"], "success_marker": "LOSSLESS_EDIT_MINIMAL: VERDE ✓"},
    {"id": "lossless_compile", "cwd": "tooling", "argv": ["node", "--import", "tsx", "test/lossless-compile-proof.ts"], "success_marker": "LOSSLESS_COMPILE_PROOF: VERDE ✓"}
  ],
  "policy": {
    "git_objects_only": true,
    "remote_ref_contains_revision_required": true,
    "tracked_worktree_excluded": true,
    "untracked_worktree_excluded": true,
    "archive_execution": true,
    "network_denied": true,
    "external_repository_writes_denied": true
  },
  "nonclaims": [
    "no_tenant_payload",
    "no_model_output",
    "no_training_authority",
    "no_accuracy_claim",
    "no_autonomous_writes",
    "nonpromotable"
  ]
}
